{
  "schemaVersion": "profile-eval-case.v1",
  "id": "full-open-source",
  "dataset": "full",
  "reviewStatus": "prelabeled",
  "tags": [
    "en",
    "open-source",
    "content-family"
  ],
  "source": {
    "type": "text",
    "path": "../sources/full-open-source.txt",
    "label": "Generated fictional Eval fixture: full-open-source"
  },
  "expected": {
    "identity": {
      "name": "Lee Chen",
      "headline": "Open Source Engineer"
    },
    "items": [
      {
        "id": "tracekit",
        "kind": "project",
        "contentFamily": "open-source",
        "canonicalTitle": "TraceKit",
        "expectedEvidence": [
          "redacted Agent event logs"
        ]
      }
    ],
    "skills": [
      "TypeScript",
      "Observability"
    ],
    "forbiddenClaims": []
  }
}
