{
  "schemaVersion": "profile-eval-case.v1",
  "id": "full-media-coverage",
  "dataset": "full",
  "reviewStatus": "prelabeled",
  "tags": [
    "en",
    "media",
    "content-family"
  ],
  "source": {
    "type": "text",
    "path": "../sources/full-media-coverage.txt",
    "label": "Generated fictional Eval fixture: full-media-coverage"
  },
  "expected": {
    "identity": {
      "name": "Owen Price",
      "headline": "Civic Technologist"
    },
    "items": [
      {
        "id": "local-systems-weekly",
        "kind": "achievement",
        "contentFamily": "media-coverage",
        "canonicalTitle": "Local Systems Weekly",
        "expectedEvidence": [
          "public data methodology"
        ]
      }
    ],
    "skills": [],
    "forbiddenClaims": []
  }
}
